{"$schema":"https://json-schema.org/draft/2020-12/schema","additionalProperties":false,"properties":{"acceptance_profile":{"const":"ai_development","title":"Acceptance Profile","type":"string"},"batch_id":{"minLength":1,"pattern":"\\S","title":"Batch Id","type":"string"},"completed_at":{"format":"date-time","pattern":"^\\d{4}-\\d{2}-\\d{2}T\\d{2}:\\d{2}:\\d{2}(?:\\.\\d{1,6})?(?:Z|[+-]\\d{2}:\\d{2})$","title":"Completed At","type":"string"},"created_at":{"format":"date-time","pattern":"^\\d{4}-\\d{2}-\\d{2}T\\d{2}:\\d{2}:\\d{2}(?:\\.\\d{1,6})?(?:Z|[+-]\\d{2}:\\d{2})$","title":"Created At","type":"string"},"disagreement_status":{"const":"not_applicable_single_ai","title":"Disagreement Status","type":"string"},"draft_path":{"const":"labels/ai_development/draft.json","title":"Draft Path","type":"string"},"draft_sha256":{"pattern":"^[0-9a-f]{64}$","title":"Draft Sha256","type":"string"},"guide_sha256":{"pattern":"^[0-9a-f]{64}$","title":"Guide Sha256","type":"string"},"human_evidence":{"const":false,"title":"Human Evidence","type":"boolean"},"independent_validation":{"const":false,"title":"Independent Validation","type":"boolean"},"input_manifest_sha256":{"pattern":"^[0-9a-f]{64}$","title":"Input Manifest Sha256","type":"string"},"review_path":{"const":"labels/ai_development/review.json","title":"Review Path","type":"string"},"review_sha256":{"pattern":"^[0-9a-f]{64}$","title":"Review Sha256","type":"string"},"revision":{"const":"ai-development-batch-v1","title":"Revision","type":"string"},"source_material_origin":{"const":"synthetic","title":"Source Material Origin","type":"string"}},"required":["revision","batch_id","acceptance_profile","source_material_origin","input_manifest_sha256","guide_sha256","created_at","completed_at","draft_path","review_path","draft_sha256","review_sha256","disagreement_status","human_evidence","independent_validation"],"title":"AIDevelopmentBatch","type":"object"}
