{"acceptance_profile":"ai_development","batch_id":"dev01-05-ai-restart-20261023","completed_at":"2026-10-23T09:35:55.184071+00:00","created_at":"2026-10-23T09:03:14.843814+00:00","disagreement_status":"not_applicable_single_ai","draft_path":"labels/ai_development/draft.json","draft_sha256":"a1e9c701c00ef7d40174aea6e5516982d948b37395f5232e5beb6a17ffb67e3b","guide_sha256":"c33e6b14082ac0898a5ff86d7c4e8c1bb58d2884b902fc2596ec635effe1a6e9","human_evidence":false,"independent_validation":false,"input_manifest_sha256":"193c775ba90709253d8def96033e2345e8254821f3776562f118ee240157b494","review_path":"labels/ai_development/review.json","review_sha256":"cf901a68e89e3da0ea67ecd29868d6c387595b6600a626aad8256ba29473fc68","revision":"ai-development-batch-v1","source_material_origin":"synthetic"}
